{
  "schemaVersion": 1,
  "id": "merge_88888888-8888-4888-8888-888888888888",
  "entityType": "person",
  "sourceId": "person_99999999-9999-4999-8999-999999999999",
  "targetId": "person_11111111-1111-4111-8111-111111111111",
  "status": "applied",
  "rationale": "完全虚构示例：人工核验后确认旧 ID 与目标 ID 表示同一个虚构人物。",
  "evidence": [
    {
      "url": "https://example.com/fictional/merge-evidence",
      "note": "完全虚构，仅演示 Merge Plan 所需的证据说明。"
    }
  ],
  "affectedEntityIds": [],
  "createdAt": "2026-09-01",
  "reviewedAt": "2026-09-02",
  "decisionNote": "示例审核通过；所有引用已经从 sourceId 改为 targetId。",
  "appliedAt": "2026-09-02"
}
